{
  "as_of":"2026-08-26",
  "business_context":"Synthetic B2B exporter test fixture used only for deterministic package validation.",
  "crm_goal":"Validate the CRM Builder research and architecture output contract.",
  "candidates":[
    {"name":"Synthetic CRM A","repo_url":"https://github.com/example/synthetic-crm-a","observed_at":"2026-08-26","language":"TypeScript","stars":100,"last_update":"2026-08-20","health_status":"ACTIVE","license":{"status":"verified","spdx":"MIT","source_url":"https://github.com/example/synthetic-crm-a/blob/main/LICENSE","obligations":["Preserve copyright and license notice"]},"capabilities":["Company","Contact","Pipeline"],"evidence":[{"url":"https://github.com/example/synthetic-crm-a/blob/main/src/model.ts","path":"src/model.ts","kind":"implementation","claim":"Synthetic fixture demonstrates an implementation-evidence record.","support_level":"direct","observed_at":"2026-08-26"},{"url":"https://github.com/example/synthetic-crm-a/blob/main/LICENSE","path":"LICENSE","kind":"license","claim":"Synthetic fixture license evidence.","support_level":"direct","observed_at":"2026-08-26"}],"reuse_decision":"ADAPT","decision_reason":"Synthetic test decision used to exercise verified-license reuse logic."},
    {"name":"Synthetic CRM B","repo_url":"https://github.com/example/synthetic-crm-b","observed_at":"2026-08-26","language":"Python","stars":null,"last_update":null,"health_status":"UNKNOWN","license":{"status":"unknown","spdx":null,"source_url":null,"obligations":[]},"capabilities":["Automation","AI"],"evidence":[{"url":"https://github.com/example/synthetic-crm-b/blob/main/README.md","path":"README.md","kind":"readme","claim":"Synthetic discovery evidence only.","support_level":"supporting","observed_at":"2026-08-26"}],"reuse_decision":"LEARN","decision_reason":"License is unknown, so the fixture permits architectural learning only."}
  ],
  "capability_matrix":[{"capability":"Company / Contact","best_source":"Synthetic CRM A","decision":"ADAPT","rationale":"Synthetic fixture for matrix generation."},{"capability":"AI Automation","best_source":"Synthetic CRM B","decision":"LEARN","rationale":"Unknown license blocks direct reuse in this synthetic fixture."}],
  "recommended_stack":["Use Synthetic CRM A only as a deterministic ADAPT test fixture.","Use Synthetic CRM B only as a LEARN test fixture."],
  "flexfang_differentiation":["Research-native evidence tracking","B2B-native qualification and next-best-action layer"],
  "architecture_decision":{"Data Model":"Separate Company, Contact, Lead, Opportunity and Activity responsibilities.","Pipeline":"Use explicit qualification, quotation, negotiation and won/lost stages.","Activity System":"Store dated activities, owner, due date and next action.","Automation":"Run deterministic rules before probabilistic AI recommendations.","AI Layer":"Use evidence-backed summaries and next-best-action recommendations with human control.","API":"Expose stable object and workflow contracts through a versioned API boundary.","Database":"Use a relational source of truth with auditable identifiers and timestamps.","Frontend":"Keep operational CRM views separate from research evidence views while linking records.","Integrations":"Integrate prospecting and communication channels through explicit adapters.","Skill Architecture":"Use separate Builder and runtime Manager Skills with clear trigger boundaries.","Agent Architecture":"Keep research/decision authority separate from production mutation authority."}
}
